{
    "schema_version":  "1.0.0",
    "protocol_version":  "1.0.2",
    "region":  "asia",
    "target_date":  "2026-08-03",
    "collection_mode":  "scheduled_live",
    "expected_run_at":  "2026-08-03T22:00:00+08:00",
    "collected_at":  "2026-08-03T22:06:00+08:00",
    "lag_days":  0,
    "backfill_reason":  null,
    "prompt_version":  "asia-collector-1.0.0",
    "weather_scoring_version":  "1.0.0",
    "market_scoring_version":  "1.0.0",
    "model_name":  "test-fixture",
    "task_run_id":  "fixture-1",
    "revision":  1,
    "supersedes_revision":  null,
    "revision_reason":  null,
    "cities":  [
                   {
                       "city_id":  "beijing",
                       "city_name":  "北京",
                       "country":  "中国",
                       "timezone":  "Asia/Shanghai",
                       "primary_exchange":  "Beijing Stock Exchange",
                       "weather_windows":  {
                                               "pre_open":  {
                                                                "start_local":  "07:30",
                                                                "end_local":  "09:30",
                                                                "metrics":  {
                                                                                "temperature_mean_c":  {
                                                                                                           "value":  20.5,
                                                                                                           "unit":  "°C",
                                                                                                           "data_type":  "observed",
                                                                                                           "source_ids":  [
                                                                                                                              "w1"
                                                                                                                          ],
                                                                                                           "notes":  null
                                                                                                       },
                                                                                "apparent_temperature_mean_c":  {
                                                                                                                    "value":  21,
                                                                                                                    "unit":  "°C",
                                                                                                                    "data_type":  "observed",
                                                                                                                    "source_ids":  [
                                                                                                                                       "w1"
                                                                                                                                   ],
                                                                                                                    "notes":  null
                                                                                                                },
                                                                                "precipitation_total_mm":  {
                                                                                                               "value":  0,
                                                                                                               "unit":  "mm",
                                                                                                               "data_type":  "observed",
                                                                                                               "source_ids":  [
                                                                                                                                  "w1"
                                                                                                                              ],
                                                                                                               "notes":  null
                                                                                                           },
                                                                                "cloud_cover_mean_pct":  {
                                                                                                             "value":  20,
                                                                                                             "unit":  "%",
                                                                                                             "data_type":  "observed",
                                                                                                             "source_ids":  [
                                                                                                                                "w1"
                                                                                                                            ],
                                                                                                             "notes":  null
                                                                                                         },
                                                                                "sunshine_duration_hours":  {
                                                                                                                "value":  2,
                                                                                                                "unit":  "h",
                                                                                                                "data_type":  "observed",
                                                                                                                "source_ids":  [
                                                                                                                                   "w1"
                                                                                                                               ],
                                                                                                                "notes":  null
                                                                                                            },
                                                                                "relative_humidity_mean_pct":  {
                                                                                                                   "value":  55,
                                                                                                                   "unit":  "%",
                                                                                                                   "data_type":  "observed",
                                                                                                                   "source_ids":  [
                                                                                                                                      "w1"
                                                                                                                                  ],
                                                                                                                   "notes":  null
                                                                                                               },
                                                                                "wind_speed_mean_kmh":  {
                                                                                                            "value":  8,
                                                                                                            "unit":  "km/h",
                                                                                                            "data_type":  "observed",
                                                                                                            "source_ids":  [
                                                                                                                               "w1"
                                                                                                                           ],
                                                                                                            "notes":  null
                                                                                                        },
                                                                                "wind_gust_max_kmh":  {
                                                                                                          "value":  15,
                                                                                                          "unit":  "km/h",
                                                                                                          "data_type":  "observed",
                                                                                                          "source_ids":  [
                                                                                                                             "w1"
                                                                                                                         ],